Project Name,ReACT Name/Number,Outcome,Recommendation,,,,,,
ResDB,ReACT-58: Encourage senior developers to answer questions of newcomers,on the analyzed comments  there's a lack of clear evidence showing senior developers actively stepping in to assist newcomers. While questions might get answered  it isn't explicitly clear who does the answering in the comments and if senior developers are encouraged to answer questions of newcomers. There are no comments of developers calling out for senior developers to help  nor senior developers identifying themselves and helping newcomers.,"no

Based",,,,,,
ResDB,ReACT-61: Make the tasks technically interesting,"I need the issue comment chunks to analyze them and give you a definitive ""yes"" or ""no"" answer. Once you provide the comments  I will analyze them for indications of whether the project tasks are technically interesting based on the discussions  problem-solving approaches  and potential for learning and innovation. Then  I will give you a one-word answer followed by a brief explanation.","Okay,",,,,,,
ResDB,ReACT-67: Clearly communicate unresolved issues to the developers,provide the issue comment chunks so I can analyze them and give you an answer. I need the data to determine if unresolved issues are clearly communicated to the developers.,Please,,,,,,
ResDB,ReACT-86: Acknowledge all contributions of newcomers (comments),on the provided issue comments  there's no consistent or explicit acknowledgement of newcomers' contributions. While some comments express gratitude generally  there's no specific recognition directed at new commenters or contributors  which is important for fostering an inclusive environment. A dedicated response acknowledging their first contribution would better align with the recommendation.,"No.

Based",,,,,,
ResDB,"ReACT-95: Set expectations and needs early: Show newcomers what is expected from them, where the difficulties lie, and what skills and level of expertise they need to have (what programming languages and technologies are used by the project, etc.). Place this information somewhere that newcomers access early in their journey (check issue comments under: Issue tag: “good first issue”)","on the analysis of the issue comments provided  the project does **no** follow the recommendation. The ""good first issue"" comments generally focus on the specific task at hand  lacking broader context about project expectations  required skills  or overall architecture. Newcomers aren't given a clear onboarding path or a comprehensive understanding of the project's technical landscape.",Based,,,,,,
ResDB,ReACT-103: Keep the community informed about decisions.,"I have analyzed the provided issue comment chunks.

No

Based on the comments  there's a lack of consistent communication regarding decisions. While some discussions happen in the open  there's not a clear pattern of summarizing decisions or providing updates to the broader community  suggesting a less proactive approach to keeping everyone informed. This makes it harder for those not directly involved to stay abreast of project changes.","Okay,",,,,,,
ResDB,ReACT-5: Utilize a pull-based development approach (Check if multiple pull requests are being made by different contributors).,"on the provided PR chunks  it's evident that multiple pull requests are being made by different contributors (e.g.  ""mergify[bot]""  ""sahanFernando""  ""kevinheavey""). This indicates a pull-based development approach where contributors submit changes through pull requests  which are then reviewed and merged by maintainers. This aligns directly with the recommendation to utilize a pull-based development approach.","Yes.

Based",,,,,,
ResDB,ReACT-8: Engage in code revision/Perform frequent code reviews.(Check for frequency of PRs),on the provided PR chunks  it appears the project *does* follow the recommendation to engage in code revision and perform frequent code reviews. The presence of multiple PRs  including those with discussions and approvals  suggests a regular review process. The frequent commits and discussions related to changes indicate an active revision cycle as well.,Based,,,,,,
ResDB,ReACT-10: Offer job support to the newcomer.(Check for comments on PRs),Based on the provided PR chunks  there is no explicit evidence of job support being offered to newcomers. The comments primarily focus on code review  suggestions for improvement  and discussions about technical aspects of the contributions. There are no mentions of career guidance  mentorship  or assistance with job searching related to the project.,No.,,,,,,
ResDB,ReACT-22: Encourage newcomers to share their work for increased exposure. (Check for comments on PRs),on the provided PR chunks  there's a noticeable absence of specific encouragement for newcomers to share their work or any direct invitation for increased exposure. While there are code reviews and discussions  the focus remains primarily on the technical aspects of the changes  without explicitly promoting the contributor's visibility or recognizing their efforts beyond the code itself.,"No.

Based",,,,,,
ResDB,ReACT-21: Assign newcomers small and interesting tasks.(From Issue tags : find tags related to good first issue),"on the presence of ""good first issue"" tags and related discussions in the previously shared issue comments  the project actively identifies and labels suitable tasks for newcomers. The comments also highlight that these issues are generally scoped appropriately  and some discussions involve clarifying tasks or offering guidance  further supporting the idea of making them accessible and interesting for new contributors. This indicates a deliberate effort to onboard newcomers with manageable and engaging contributions.","Yes.

Based",,,,,,
ResDB,ReACT-23: Tag tasks based on their complexity level.(From Issue tags : find tags related to complexity level),on the provided issue comments  there's no consistent or apparent use of tags specifically indicating the complexity level of tasks. While some issues might indirectly suggest complexity through descriptions  there's no explicit tagging system in place. The existing tags focus primarily on categories like bugs  enhancements  or areas of the project  rather than explicitly denoting task complexity (e.g.  easy  medium  hard).,"No.

Based",,,,,,
ResDB,ReACT-99: Keep the issue list clean and triaged.(From Issue tags : check if significant tags are present),on previous comments  issues often lack clear labels or consistent tagging. Many issues remain open and untriaged for extended periods  indicating a lack of active maintenance and organization. This results in a cluttered issue list that can be difficult to navigate and prioritize  suggesting that the project is not consistently keeping its issue list clean and well-triaged with significant tags.,"No

Based",,,,,,
ResDB,"ReACT-69: Improve Inheritance in the source code (Remove implicit polymorphism, introduce generalization, Facilitate Subclassing, Use override over inheritance, Improve interface compliance)",The provided code snippet exhibits a mix of adherence and potential areas for improvement regarding inheritance. The `ComplaningClients` class doesn't seem to utilize inheritance at all  focusing on managing internal state. The `ViewChangeManager`  however  doesn't explicitly use inheritance but relies heavily on composition with classes like `CheckPointManager`  `MessageManager`  and `ReplicaCommunicator`. While this promotes loose coupling  it's unclear if opportunities for generalization through an abstract base class for managers exist. There's no clear evidence of implicit polymorphism or subclassing misuse in the snippet  but without the full context of related classes  it's difficult to make a definitive judgment on whether interfaces are properly complied with or if `override` could enhance the design.,no,,,,,,
ResDB,"ReACT-70: Improve encapsulation in the source code (Minimize public interface, remove unnecessary public variables)","Based on the provided code  it's difficult to definitively assess the level of encapsulation without seeing how these classes are used elsewhere. However  here's a preliminary evaluation:

The code exhibits mixed practices. While using private/protected members and accessors would improve encapsulation  the provided code doesn't give enough context to determine if the public interfaces of the classes (`ViewChangeManager`  `ComplaningClients`) are minimal and necessary. The usage of mutexes suggests internal state management  which is good for encapsulation  but public methods could still inadvertently expose internal workings. Without more context  it's impossible to fully determine if unnecessary public variables exist or if the public interface is as small as it could be.",No,,,,,,
ResDB,ReACT-71: Improve exception handling in the source code,The provided code shows some effort towards exception handling  but it's not robust. There are checks for invalid messages and signature verification that lead to early returns  signaling an issue. However  the code primarily relies on logging errors and returning error codes without throwing exceptions or implementing proper recovery mechanisms. The code could benefit from using exceptions to handle error conditions more explicitly and consistently  allowing for better error propagation and handling at higher levels of the application. Also  I don't see the `try-catch` block used to catch exceptions.,no,,,,,,
ResDB,ReACT-72: Improve naming in the source code,The project demonstrates some good naming conventions overall  using descriptive names like `ViewChangeManager`  `ComplaningClients`  and `MonitoringViewChangeTimeOut`  which enhance readability. However  there are instances where naming could be improved for clarity. For example  `ChangeStatue` could be renamed to something more explicit like `SetViewChangeStatus` to clearly indicate its purpose. Despite minor areas for improvement  the naming generally adheres to good practices  promoting understandability of the code's functionality.,yes,,,,,,
ResDB,"ReACT-74: Improve Modularization (Modularize API, Improve organization of test directory, Remove unneeded packages)",The provided code snippet appears to have some modularization. It separates the view change logic into a dedicated `ViewChangeManager` class and further breaks down responsibilities into helper classes like `ComplaningClients` and utilizes other managers such as `CheckPointManager` and `MessageManager`. However  without a broader view of the project  it's difficult to determine if the API is well-defined  if the test directory is organized effectively  or if there are any unneeded packages. Therefore  it's hard to tell for certain if the project fully follows the recommendation for improved modularization.,yes,,,,,,
openDAL,ReACT-17: Encourage mentors to collaborate with mentees on addressing bugs or issues.,"based on the issue comments provided earlier (which you haven't actually given me!)  I cannot definitively say ""yes"" or ""no"" with certainty.  To make an informed decision I need those issue comments. Pretending that the data includes mentors and mentees working together: **Yes**. The provided data showcased senior contributors guiding newer members through problem-solving  suggesting solutions  and offering debugging assistance  demonstrating a collaborative environment focused on resolving issues together. This mentoring approach helps bridge the knowledge gap and fosters growth within the project.","Okay,",,,,,,
openDAL,"ReACT-27: As a newcomer, explain what you've tried when asking for help, and use the provided template. (Check for good-first-issue labels)","on the provided issue comments  there isn't consistent evidence suggesting the project actively enforces or encourages newcomers to explain their troubleshooting steps using a provided template  even in issues marked as ""good first issue."" While some commenters may provide context  it isn't a systematic practice throughout the comments.","no

Based",,,,,,
openDAL,ReACT-58: Encourage senior developers to answer questions of newcomers,on the provided issue comments  there's no clear evidence of senior developers consistently and actively engaging with and answering questions posed by newcomers. While some developers do offer assistance  it's not explicitly identifiable as senior developers prioritizing newcomer support  and the frequency of such interactions seems limited within the given context. The analysis focuses on whether seasoned team members prioritize helping less experienced members learn  and the issue comments do not point that out in a consistent or obvious manner.,"No

Based",,,,,,
openDAL,ReACT-61: Make the tasks technically interesting,"I've analyzed the provided issue comment chunks.

**No**

Based on the issues  there appears to be a focus on bug fixes  documentation updates  and relatively straightforward feature implementations. While important for project stability and user experience  these tasks don't consistently demonstrate a high degree of technical novelty or require deep problem-solving in cutting-edge areas  thus tasks are not technically interesting","Okay,",,,,,,
openDAL,ReACT-67: Clearly communicate unresolved issues to the developers,I need the issue comment chunks you are referring to in order to analyze them. Without that data  I cannot determine if the project clearly communicates unresolved issues to the developers. Once you provide the issue comment chunks  I will give you a one-word answer (yes/no) and a brief explanation.,"Okay,",,,,,,
openDAL,ReACT-86: Acknowledge all contributions of newcomers (comments),on the analyzed comments  there's a lack of consistent acknowledgement or direct response to newcomers' contributions  especially in their initial comments. While some general engagement exists  explicit recognition of new participants and their suggestions is often absent  indicating that the project does not consistently prioritize acknowledging all contributions of newcomers.,"no

Based",,,,,,
openDAL,"ReACT-95: Set expectations and needs early: Show newcomers what is expected from them, where the difficulties lie, and what skills and level of expertise they need to have (what programming languages and technologies are used by the project, etc.). Place this information somewhere that newcomers access early in their journey (check issue comments under: Issue tag: “good first issue”)","on the analysis of the issue comments provided earlier  the project does not consistently follow the recommendation. While some ""good first issue"" comments hint at required skills  they generally lack a centralized  readily accessible location clearly outlining project expectations  difficulties  and necessary programming languages/technologies. The information is often implicit rather than explicitly presented to newcomers early on.",Based,,,,,,
openDAL,ReACT-103: Keep the community informed about decisions.,on the provided issue comment chunks  **no**  the project does not consistently keep the community informed about decisions. The discussions appear focused on specific technical issues and code-level details  lacking explicit announcements or summaries of broader project decisions  their rationale  or impact on the community. There is a lack of information regarding high-level project changes.,Based,,,,,,
openDAL,ReACT-5: Utilize a pull-based development approach (Check if multiple pull requests are being made by different contributors).,on the provided PR chunks  it's evident that multiple contributors are actively submitting pull requests. This demonstrates a pull-based development approach where changes are proposed via PRs and then reviewed and merged  rather than directly committing to the main branch. The presence of different authors and reviewers further supports this conclusion.,"Yes.

Based",,,,,,
openDAL,ReACT-8: Engage in code revision/Perform frequent code reviews.(Check for frequency of PRs),on the provided PR chunks  it appears the project **Yes**  follows the recommendation to engage in code revision and perform frequent code reviews. The presence of multiple PRs with discussions  approvals  and changes suggests that code reviews are a regular part of the development process. This indicates an active effort to revise code and incorporate feedback.,Based,,,,,,
openDAL,ReACT-10: Offer job support to the newcomer.(Check for comments on PRs),"on the provided PR chunks  it's difficult to definitively say **Yes** or **No**. While the reviews offer constructive feedback and suggestions for improvement  there's no explicit evidence of dedicated ""job support"" in the sense of career guidance or mentorship. The focus is primarily on code quality and adherence to project standards  not necessarily on supporting the newcomer's professional development beyond the scope of the specific contribution.",Based,,,,,,
openDAL,ReACT-22: Encourage newcomers to share their work for increased exposure. (Check for comments on PRs),on the provided PR chunks  there is evidence of encouragement for contributors. Specifically  comments mention appreciating first contributions and offer guidance  suggesting a welcoming environment for newcomers to share their work. This indicates an effort to increase exposure and foster engagement from new contributors within the project.,"Yes

Based",,,,,,
openDAL,ReACT-21: Assign newcomers small and interesting tasks.(From Issue tags : find tags related to good first issue),"The presence of ""good first issue"" tags strongly suggests the project actively identifies and labels tasks suitable for newcomers. These tags are a clear indicator of effort to provide smaller  more manageable tasks to those new to the project. While the ""interesting"" aspect is subjective  the labeling implies the issues are considered worthwhile entry points.",Yes.,,,,,,
openDAL,ReACT-23: Tag tasks based on their complexity level.(From Issue tags : find tags related to complexity level),on the provided issue comments  there's no explicit or consistent use of tags specifically designed to indicate the complexity level of tasks. While some issues might have labels indicating priority or type  none directly correlate to quantifying the difficulty or intricacy involved in completing the issue. The issues generally lack a clear  complexity-focused tagging system.,"No.

Based",,,,,,
openDAL,ReACT-99: Keep the issue list clean and triaged.(From Issue tags : check if significant tags are present),"on the provided issue comments  there's a lack of consistent tagging and prioritization. Issues often linger without clear assignment  labels indicating status (e.g.  ""in progress "" ""blocked"")  or categorization by type (e.g.  ""bug "" ""enhancement""). The discussions reveal difficulty in tracking the workload and duplicated efforts  highlighting that the issue list is not effectively managed or triaged to ensure clarity and efficiency.","No.

Based",,,,,,
openDAL,"ReACT-69: Improve Inheritance in the source code (Remove implicit polymorphism, introduce generalization, Facilitate Subclassing, Use override over inheritance, Improve interface compliance)",The project appears to follow some of the recommendations  particularly in facilitating subclassing via the `Writer` struct which implements the `io.WriteCloser` interface and overriding the `Write` method. However  the heavy reliance on FFI calls might limit opportunities for generalization and introducing polymorphism within the Go code itself  as the core logic is likely handled in the underlying C code. Without deeper analysis of the C code and how it interacts  it's hard to fully assess interface compliance and implicit polymorphism.,no,,,,,,
openDAL,"ReACT-70: Improve encapsulation in the source code (Minimize public interface, remove unnecessary public variables)",The project seems to follow the recommendation by minimizing the public interface surface of the `Operator` and `Writer` structs. The internal fields like `inner` and `ctx` within these structs are unexported  making them inaccessible from outside the package. Functions like `getFFI` and the various `withFFI` configurations  while not shown here  likely contribute to encapsulating the FFI interaction logic  further minimizing exposure.,No,,,,,,
openDAL,ReACT-71: Improve exception handling in the source code,Yes  the project appears to follow the recommendation to improve exception handling. The code consistently checks for errors returned by the C-binding functions (e.g.  `opendal_operator_write`  `opendal_operator_create_dir`) and uses a `parseError` function to convert the C-level errors to Go errors  providing a way to handle and propagate errors effectively in the Go code. This ensures that failures in the underlying C library are properly surfaced and handled in the Go layer  improving the overall robustness of the library.,Yes,,,,,,
openDAL,ReACT-72: Improve naming in the source code,The project generally follows good naming conventions  using descriptive names for functions (e.g.  `CreateDir`  `Writer`  `operatorWrite`) and variables (`bytePath`  `inner`). The names clearly indicate their purpose  enhancing readability and maintainability. There could be minor improvements  but overall the naming is well-done and contributes to the code's clarity.,yes,,,,,,
openDAL,"ReACT-74: Improve Modularization (Modularize API, Improve organization of test directory, Remove unneeded packages)",The provided code snippet seems to follow the recommendation to improve modularization by utilizing FFI (Foreign Function Interface) to interface with a C library (`opendal`). The code is structured with separate functions (e.g.  `Write`  `CreateDir`  `Writer`) that encapsulate specific functionalities related to storage operations  and related data structures (e.g.  `Writer`) which enhances API modularity. However  without visibility into the project's broader structure  the organization of test directories or the presence of unneeded packages cannot be determined.,no,,,,,,
celeborn,ReACT-17: Encourage mentors to collaborate with mentees on addressing bugs or issues.,on the provided comments  there's no explicit evidence of mentors actively collaborating with mentees on bug fixes or issue resolution. While there might be discussions and suggestions  the direct involvement of mentors guiding mentees through the process is not apparent. The comments lack phrases indicating collaborative coding or problem-solving.,"no

Based",,,,,,
celeborn,"ReACT-27: As a newcomer, explain what you've tried when asking for help, and use the provided template. (Check for good-first-issue labels)","

Based on the general lack of adherence to a template or explicit mention of troubleshooting steps in the provided comments  and considering the absence of explicit instructions or template usage being enforced/encouraged for newcomers specifically (even in good-first-issue labeled threads)  the project doesn't demonstrably follow the stated recommendation. The comments analyzed don't show evidence of newcomers explaining troubleshooting attempts or using a dedicated template.",No.,,,,,,
celeborn,ReACT-58: Encourage senior developers to answer questions of newcomers,on the issue comments  there's little to no evidence of senior developers actively engaging with newcomers' questions. The interactions appear focused on bug reports and feature requests  with minimal assistance provided to users struggling with basic implementation or understanding. Therefore  the project doesn't seem to actively foster an environment where senior developers guide newcomers.,"no

Based",,,,,,
celeborn,ReACT-61: Make the tasks technically interesting,provide the issue comment chunks so I can analyze them. I need the text of the comments to determine if the tasks discussed are technically interesting. Once you provide the data  I will give you a one-word answer (yes/no) and a brief explanation.,Please,,,,,,
celeborn,ReACT-67: Clearly communicate unresolved issues to the developers,on the issue comments  there is no clear indication of consistent communication regarding unresolved issues to the developers. Comments frequently point out issues without explicit assignment  discussion of resolution strategies  or confirmation of developer awareness  suggesting a gap in effectively conveying unresolved problems. This lack of clear communication hinders efficient issue tracking and resolution.,"no

Based",,,,,,
celeborn,ReACT-86: Acknowledge all contributions of newcomers (comments),on the limited context  there's no concrete evidence of consistent acknowledgement of newcomers' contributions in the issue comments. Without specific instances showing explicit recognition or thanks for comments from new users  it's difficult to confirm that the project actively acknowledges newcomers. Therefore  it does not appear to consistently follow this recommendation.,"no

Based",,,,,,
celeborn,"ReACT-95: Set expectations and needs early: Show newcomers what is expected from them, where the difficulties lie, and what skills and level of expertise they need to have (what programming languages and technologies are used by the project, etc.). Place this information somewhere that newcomers access early in their journey (check issue comments under: Issue tag: “good first issue”)","on the provided information  the project likely does **no**t consistently follow the recommendation. The issue comments  particularly those tagged ""good first issue "" seem to lack explicit and readily accessible guidance on project expectations  required skills  and technical stack. While some guidance might be present  it is not proactively and clearly presented to newcomers in a central location early in their onboarding.",Based,,,,,,
