Project Name,ReACT Name/Number,Outcome,Recommendation,,,,,,
celeborn,ReACT-103: Keep the community informed about decisions.,"provide me with the ""issue comments chunks"" you are referring to. I need that data to analyze the communication and determine if the project keeps the community informed about decisions. Once you provide the data  I will give you a one-word answer (yes or no) and the short explanation.",Please,,,,,,
celeborn,ReACT-5: Utilize a pull-based development approach (Check if multiple pull requests are being made by different contributors).,"on the provided PR chunks  multiple pull requests are being made by different contributors. This activity signifies that contributors are working on their changes independently and submitting them for review and integration  demonstrating a pull-based development approach where changes are ""pulled"" into the main codebase rather than pushed directly.","Yes

Based",,,,,,
celeborn,ReACT-8: Engage in code revision/Perform frequent code reviews.(Check for frequency of PRs),"The provided PR chunks demonstrate frequent submissions and updates  suggesting an active code review process. The presence of multiple commits  comments  and labels like ""needs review"" and ""reviewing"" on individual pull requests indicates a consistent engagement in code revision. This ongoing collaboration points toward the practice of performing frequent code reviews within the project.",Yes.,,,,,,
celeborn,ReACT-10: Offer job support to the newcomer.(Check for comments on PRs),Based on the provided PR chunks  there is no explicit evidence of offering job support to newcomers. The discussions primarily focus on code review  bug fixes  feature implementations  and general project maintenance. There are no comments or interactions suggesting any form of career guidance or job placement assistance being offered to contributors.,No.,,,,,,
celeborn,ReACT-22: Encourage newcomers to share their work for increased exposure. (Check for comments on PRs),Based on the PR chunks  there are encouraging and supportive comments on contributions  even from first-time contributors. Maintainers actively provide feedback and guidance  fostering a welcoming environment for newcomers to showcase their work. This suggests a conscious effort to increase visibility for new contributors and their contributions.,Yes.,,,,,,
celeborn,ReACT-21: Assign newcomers small and interesting tasks.(From Issue tags : find tags related to good first issue),"on the analysis of previous issue comments  the project actively utilizes ""good first issue"" tags. These tagged issues often describe relatively small  self-contained tasks that newcomers can address to contribute to the project. The comments indicate efforts to provide clear instructions and support  which aligns with making these tasks approachable and interesting for newcomers  thus following the recommendation.","Yes

Based",,,,,,
celeborn,ReACT-23: Tag tasks based on their complexity level.(From Issue tags : find tags related to complexity level),on the provided issue comments  there's no explicit mention or consistent use of tags that directly indicate the complexity level of tasks. While some issues might touch upon complex features or require significant effort  these are not explicitly categorized or tagged to reflect their difficulty or complexity in a standardized way across the project. Therefore  the recommendation is not being followed.,"No.

Based",,,,,,
celeborn,ReACT-99: Keep the issue list clean and triaged.(From Issue tags : check if significant tags are present),on the provided context  the issue list is likely not well-maintained. The issues lack proper tagging  making it difficult to prioritize and categorize them effectively. This lack of organization suggests a failure to triage issues regularly and keep the list clean and manageable. The absence of significant tags highlights that the project isn't actively using them for organization.,"No

Based",,,,,,
celeborn,"ReACT-69: Improve Inheritance in the source code (Remove implicit polymorphism, introduce generalization, Facilitate Subclassing, Use override over inheritance, Improve interface compliance)",The provided code snippet doesn't demonstrate inheritance. It's a simple data class (POJO) `WorkerInfoResponse` with various fields and getter/setter methods  primarily used for data transfer.  Therefore  recommendations about improving inheritance are not applicable here  as there is no inheritance to improve.,no,,,,,,
celeborn,"ReACT-70: Improve encapsulation in the source code (Minimize public interface, remove unnecessary public variables)",The provided code does not fully follow the recommendation to improve encapsulation. While it uses `private` for the member variables and provides getter and setter methods  it exposes all the internal state of the `WorkerInfoResponse` object. Ideally  the public interface should be minimized to only the methods necessary for external interaction  and unnecessary public setters should be avoided to maintain object immutability or controlled state changes. The numerous public setters allow external modification of the object's internal state  violating encapsulation principles.,no,,,,,,
celeborn,ReACT-71: Improve exception handling in the source code,The provided code mainly defines a data model (`WorkerInfoResponse`) using Java and Jackson annotations for serialization and deserialization.  It doesn't contain any explicit exception handling logic. Therefore  based solely on this snippet  it's impossible to determine if the project as a whole improves exception handling.  The class only describes the structure of a response object  and doesn't perform any operations that might throw exceptions.,No,,,,,,
celeborn,ReACT-72: Improve naming in the source code,on previous comments  there are consistent suggestions to refine variable names  function names  or class names for better clarity and understandability. This indicates that the project currently has areas where naming conventions could be improved to align with best practices. The frequent feedback suggests that the project does not consistently follow the recommendation to improve naming in the source code.,"No

Based"
celeborn,"ReACT-74: Improve Modularization (Modularize API, Improve organization of test directory, Remove unneeded packages)",on the prior comments  there's been discussion around breaking down large files and organizing test directories. Some packages have been identified as potentially unnecessary. However  there's no definitive confirmation that all these modularization improvements have been fully implemented across the project. Therefore  it's unlikely the project fully adheres to the recommendation.,"No

Based"
